{
 "schemaVersion": 1,
 "id": "duel_marchward_forms",
 "type": "duel",
 "name": "A Duel Under Forms",
 "locationId": "the_marchward",
 "setup": "The Marchward's ground is neutral by treaty and its duels are formal by law. A challenge here is answered under forms: salute, engagement, a called stop. Withdrawal is permitted and it is remembered.",
 "lethal": false,
 "opponent": {
  "name": "a Marcher of the ward",
  "threat": 40,
  "fleeDifficulty": 20,
  "spectrum": {
   "violence_peace": -0.2
  },
  "tacticTags": [
   "formal-salute",
   "calls-the-stop",
   "punishes-the-unformed",
   "will-not-strike-a-turned-back"
  ],
  "yieldAtFraction": 0.2,
  "_poolsDerived_20260905": "health removed: it was on the retired 3-7 scale and overrode a live synthesised sheet, which made a bout end in a median of ONE turn. The pool now derives from standing (30 + 5/level) through the level the threat implies. `yieldAtFraction` replaces an absolute `yieldAt` because a ratio is scale-free."
 }
}
